{
  "recordId": "EXAMPLE-001",
  "version": "0.1",
  "scope": "Illustrative bounded declaration (not certified)",
  "sourceAuthority": "HDIP-CLA-0.1-M17",
  "profilePatternRefs": [
    "M14-PP-01"
  ],
  "dimensions": {
    "identityVersion": {},
    "scope": {},
    "parentBaseline": {},
    "externalAuthorities": {},
    "applicablePlanesABBs": {},
    "applicableOverlays": {},
    "lifecycleSpecialization": {},
    "registryProjectionSpecialization": {},
    "interactionSpecialization": {},
    "boundarySpecialization": {},
    "allowedRealizationPatterns": {},
    "evidenceAssurance": {},
    "nonApplicabilityRationale": {},
    "conformanceClaim": {},
    "invariantApplicabilityMatrix": {},
    "specializationOperationRecord": {},
    "profileCompositionConflictRecord": {},
    "profileAssessmentEvidenceState": {}
  },
  "specializationOperations": [
    {
      "operation": "TIGHTEN",
      "baselineReference": "M16-I01",
      "rationale": "Example strengthening only"
    }
  ],
  "assessmentStatus": "NOT_ASSESSED",
  "noWaiverOfCoreInvariants": true
}
